{
  "schema_version": "1.0",
  "algorithm": "ed25519",
  "receipt": {
    "resolution_id": "RESOLUTION-001",
    "action_id": "LOGIN-001",
    "action_class": "operational_action",
    "owner": "product-owner",
    "scope": "one exact account login",
    "request_sha256": "REPLACE_WITH_64_CHARACTER_SHA256",
    "status": "completed",
    "evidence_sha256": "REPLACE_WITH_64_CHARACTER_SHA256",
    "resolved_at": "2026-08-16T00:00:00Z",
    "expires_at": "2026-08-16T01:00:00Z",
    "nonce": "replace-with-unique-nonce"
  },
  "signature": "REPLACE_WITH_BASE64_ED25519_SIGNATURE"
}
